{
  "contract_version": 2,
  "kind": "plugin",
  "name": "accent-contact",
  "version": "0.1.0",
  "accent_version": ">=0.24.0",
  "api_version": "0.1.0",
  "published_at": "2026-08-10T17:03:59Z",
  "trust": "official",
  "author": "accentx",
  "distribution": "registry",
  "artifact": {
    "url": "https://github.com/AccentCMS/accent-contact/releases/download/v0.1.0/accent-contact-0.1.0.tar.gz",
    "checksum": "sha256:ad905d8bfd587a564c53f444252ce4a580e02fd5157fad954b6284eaa0eed7c5",
    "size_bytes": 36475
  },
  "pricing": {
    "model": "free"
  },
  "islands": [
    "reading-time",
    "word-count"
  ],
  "yanked": false
}
